{
  "$schema": "./stage-roles.schema.json",
  "schemaVersion": 1,
  "kind": "ccof.stage-roles",
  "description": "The deployment stages in Stage-map order (docs/DEPLOYMENT-STAGES.md, Stage map), as data for scripts/Get-DeploymentPlan.ps1: the checkpoint records that complete each stage, the records it reads, the roles and scopes it needs, its blockers, its read-only probes, and its command or handoff. Placeholders: ${answers.<path>}, ${d1.<key>} (stage-D1 outputs) and ${item.<field>} (the row: a project or backend entry, step, answersPath, checkpointPath, outputDirectory, onboardingAnswersPath, steps, and revision from stage-D2:policy). Each role in anyOf is named by the line its requirement cites, except Owner (ownerAccepted).",
  "ownerAccepted": {
    "text": "Owner grants full access to manage all resources, including the ability to assign roles in Azure RBAC, so a requirement may list it beyond its cited source.",
    "source": "https://learn.microsoft.com/azure/role-based-access-control/built-in-roles/privileged",
    "retrieved": "2026-10-12"
  },
  "stages": [
    {
      "id": "D0", "mapRow": 1, "title": "D0 Decisions",
      "form": "scripts/Stage0-AvailabilityDecisions.ps1",
      "performer": "Deploying administrator",
      "records": ["stage-D0"], "reads": [],
      "requirements": [
        { "kind": "azure-rbac", "scope": "/subscriptions/${answers.target.subscriptionId}", "anyOf": ["Reader", "Contributor", "Owner"], "heldBy": "Deploying administrator", "purpose": "region checks", "source": "scripts/Stage0-AvailabilityDecisions.ps1:207" }
      ],
      "discovery": [
        { "kind": "checkpoint-file", "suffix": ".d0-availability.json", "label": "D0 availability export" },
        { "kind": "answers-section", "anyOf": ["availability", "availabilityFile"], "label": "availability decisions in the answers" }
      ],
      "command": "pwsh -NoProfile -File scripts/Stage0-AvailabilityDecisions.ps1 -AnswersFile <D0 answers, docs/HA-DECISIONS.md section 7> -CheckpointPath ${item.checkpointPath} -DiscoverOnly",
      "handoff": "The deploying administrator runs D0 with Reader on the subscription: -DiscoverOnly first, then without it to record the decisions.",
      "sources": ["docs/DEPLOYMENT-STAGES.md:13", "scripts/Stage0-AvailabilityDecisions.ps1:10"]
    },
    {
      "id": "D1", "mapRow": 2, "title": "D1 Prerequisite resources",
      "form": "docs/PREREQUISITES-WORKBOOK.md, infra/prereqs/*.bicep, scripts/Record-Prerequisites.ps1",
      "performer": "Infrastructure teams",
      "records": ["stage-D1"], "reads": [], "answersStage": "D1",
      "requirements": [
        { "kind": "azure-rbac", "scope": "/subscriptions/${answers.target.subscriptionId}/resourceGroups/${answers.target.resourceGroup.name}", "anyOf": ["Contributor", "Owner"], "heldBy": "Infrastructure team", "purpose": "create the prerequisite resources", "source": "docs/DEPLOYMENT-STAGES.md:14" },
        { "kind": "entra-directory", "scope": "/", "anyOf": ["Application Administrator", "Cloud Application Administrator"], "tenantSetting": "allowedToCreateApps", "heldBy": "Entra application administrator", "purpose": "the app registrations", "source": "docs/DEPLOYMENT-GUIDE.md:77" }
      ],
      "discovery": [ { "kind": "d1-record" } ],
      "command": "pwsh -NoProfile -File scripts/Record-Prerequisites.ps1 -Action Plan -AnswersPath ${item.answersPath} -CheckpointPath ${item.checkpointPath}",
      "handoff": "The infrastructure team creates the resources from docs/PREREQUISITES-WORKBOOK.md, then runs Record-Prerequisites.ps1 -Action Record.",
      "sources": ["docs/DEPLOYMENT-STAGES.md:14", "scripts/Record-Prerequisites.ps1:17"]
    },
    {
      "id": "D2", "mapRow": 3, "title": "D2 Schema and apps",
      "form": "scripts/Stage-D2-DeploySchemaAndApps.ps1",
      "performer": "Platform deployer",
      "steps": ["schema", "settings", "resolver-auth", "apim", "diagnostics", "workbook"],
      "records": ["stage-D2:${item.step}"], "reads": ["stage-D1"], "answersStage": "D2",
      "requirements": [
        { "kind": "azure-rbac", "scope": "/subscriptions/${answers.target.subscriptionId}/resourceGroups/${answers.target.resourceGroup.name}", "anyOf": ["Contributor", "Owner"], "heldBy": "Platform deployer", "purpose": "deploy the schema, settings, API and diagnostics", "source": "docs/DEPLOYMENT-STAGES.md:15" }
      ],
      "discovery": [
        { "kind": "d2-plan" },
        { "kind": "arm-get", "step": "apim", "label": "API ${answers.apim.apiId}", "url": "${d1.apim.id}/apis/${answers.apim.apiId}?api-version=2024-05-01" }
      ],
      "command": "pwsh -NoProfile -File scripts/Stage-D2-DeploySchemaAndApps.ps1 -Action Plan -AnswersPath ${item.answersPath} -CheckpointPath ${item.checkpointPath}",
      "commandSteps": "pwsh -NoProfile -File scripts/Stage-D2-DeploySchemaAndApps.ps1 -Action Plan -AnswersPath ${item.answersPath} -CheckpointPath ${item.checkpointPath} -Steps ${item.steps}",
      "handoff": "The platform deployer runs D2 with Contributor on the resource group: -Action Plan, then -Action Apply.",
      "sources": ["docs/DEPLOYMENT-STAGES.md:15", "docs/DEPLOYMENT-STAGES.md:24", "scripts/Core.D2Stage.psm1:20"]
    },
    {
      "id": "D3", "mapRow": 4, "title": "D3 Permissions",
      "form": "scripts/Stage-D3-GrantPermissions.ps1",
      "performer": "Access team",
      "records": ["stage-D3"], "reads": ["stage-D1", "stage-D2:schema"], "answersStage": "D3",
      "requirements": [
        { "kind": "azure-rbac", "scope": "/subscriptions/${answers.target.subscriptionId}/resourceGroups/${answers.target.resourceGroup.name}", "anyOf": ["Role Based Access Control Administrator", "User Access Administrator", "Owner"], "heldBy": "Access team", "purpose": "Azure role assignments (Microsoft.Authorization/roleAssignments/write; Owner includes it)", "source": "docs/DEPLOYMENT-STAGES.md:16" },
        { "kind": "azure-rbac", "scope": "${d1.cosmos.id}", "anyOf": ["Contributor", "Owner"], "heldBy": "Access team", "purpose": "Cosmos data-plane assignments (sqlRoleAssignments/write)", "source": "docs/DEPLOYMENT-STAGES.md:16" },
        { "kind": "entra-directory", "scope": "/", "anyOf": ["Privileged Role Administrator", "Global Administrator"], "when": "answers.sync.mode == application-permission", "blocking": false, "heldBy": "Entra privileged administrator", "purpose": "the Microsoft Graph application permission; without it D3 records the item pending and prints docs/DEPLOYMENT-GUIDE.md Step 7", "source": "scripts/Core.PermissionsApply.psm1:18" }
      ],
      "discovery": [
        { "kind": "d3-plan" },
        { "kind": "graph-app-role", "when": "answers.sync.mode == application-permission", "label": "sync identity holds Graph ${answers.sync.graphPermission.permission}", "principal": "${d1.apps.sync.principalId}", "appRoleId": "${answers.sync.graphPermission.appRoleId}" }
      ],
      "command": "pwsh -NoProfile -File scripts/Stage-D3-GrantPermissions.ps1 -Action Plan -AnswersPath ${item.answersPath} -CheckpointPath ${item.checkpointPath}",
      "handoff": "The access team runs D3: -Action Plan, review it, then -Action Apply -PlanDigest <first 12 characters of the digest shown>.",
      "sources": ["docs/DEPLOYMENT-STAGES.md:16", "scripts/Stage-D3-GrantPermissions.ps1:21"]
    },
    {
      "id": "D2-resumed", "mapRow": 5, "title": "D2, resumed",
      "form": "scripts/Stage-D2-DeploySchemaAndApps.ps1",
      "performer": "Platform deployer",
      "steps": ["code", "policy", "smoke"],
      "records": ["stage-D2:${item.step}"], "reads": ["stage-D1", "stage-D3"], "answersStage": "D2",
      "requirements": [
        { "kind": "azure-rbac", "scope": "/subscriptions/${answers.target.subscriptionId}/resourceGroups/${answers.target.resourceGroup.name}", "anyOf": ["Contributor", "Owner"], "heldBy": "Platform deployer", "purpose": "deploy code and the policy revision", "source": "docs/DEPLOYMENT-STAGES.md:15" }
      ],
      "discovery": [
        { "kind": "d2-plan" },
        { "kind": "arm-get", "step": "code", "count": true, "label": "resolver functions", "url": "${d1.apps.resolver.functionAppId}/functions?api-version=2024-04-01" },
        { "kind": "arm-get", "step": "code", "count": true, "label": "sync functions", "url": "${d1.apps.sync.functionAppId}/functions?api-version=2024-04-01" },
        { "kind": "arm-get", "step": "code", "count": true, "label": "reconciler functions", "url": "${d1.apps.reconciler.functionAppId}/functions?api-version=2024-04-01" },
        { "kind": "api-revisions", "step": "policy", "api": "${d1.apim.id}/apis/${answers.apim.apiId}" }
      ],
      "command": "pwsh -NoProfile -File scripts/Stage-D2-DeploySchemaAndApps.ps1 -Action Plan -AnswersPath ${item.answersPath} -CheckpointPath ${item.checkpointPath}",
      "commandSteps": "pwsh -NoProfile -File scripts/Stage-D2-DeploySchemaAndApps.ps1 -Action Plan -AnswersPath ${item.answersPath} -CheckpointPath ${item.checkpointPath} -Steps ${item.steps}",
      "handoff": "The platform deployer runs D2 again after D3: -Action Plan, then -Action Apply.",
      "sources": ["docs/DEPLOYMENT-STAGES.md:17", "docs/DEPLOYMENT-STAGES.md:26"]
    },
    {
      "id": "S1", "mapRow": 6, "title": "D4 Groups (onboarding Stage 1)",
      "form": "scripts/Stage1-CreateClassificationGroups.ps1",
      "performer": "Onboarding operator",
      "forEach": "answers.onboarding.projects", "itemKey": "projectId", "onboardingStage": "1",
      "records": ["stage-1-groups:${item.projectId}"], "reads": ["stage-D1"],
      "requirements": [
        { "kind": "entra-directory", "scope": "/", "anyOf": ["Groups Administrator", "Global Administrator"], "tenantSetting": "allowedToCreateSecurityGroups", "heldBy": "Onboarding operator (Groups Administrator when users cannot create security groups)", "purpose": "create the classification groups", "source": "scripts/Stage1-CreateClassificationGroups.ps1:47" }
      ],
      "discovery": [